### ISSUE TITLE
Open port TCP UDP

### ISSUE THREAD

**Issue by sonnyxp2008** [Ysurac/openmptcprouter#1940]
## Expected Behavior
open the tcp and udp port 44158

## Current Behavior
I re-address all the ports on the OMR and Port Forwards firewall I open port 44158 on the affected ip which in this case is my pc. The door remains closed

## Specifications

  - OpenMPTCProuter version: v0.58rc5
  - OpenMPTCProuter VPS version: 5.4.100-mptcp 0.1026
  - OpenMPTCProuter platform: x86_64

**Comment by Ysurac** [comment]
You followed https://github.com/Ysurac/openmptcprouter/wiki/Port-forwarding#debug ?

**Comment by sonnyxp2008** [comment]
I'm sorry but I have no results, the door remains closed. this is what omr tells me

root@OpenMPTCProuter:~# tcpdump -i tun0 port 44158
tcpdump: verbose output suppressed, use -v or -vv for full protocol decode
listening on tun0, link-type RAW (Raw IP), capture size 262144 bytes
13:08:40.196086 IP 198.xxx.xxx.xxx.47660 > 10.255.255.2.44158: Flags [S], seq 180                              1328523, win 14600, options [mss 1460,sackOK,TS val 59463399 ecr 0,nop,wscale 8]                              , length 0
13:08:40.196141 IP 10.255.255.2.44158 > 198.xxx.xxx.xxx.47660: Flags [R.], seq 0,                               ack 1801328524, win 0, length 0
13:08:40.403029 IP 198.xxx.xxx.xxx.47662 > 10.255.255.2.44158: Flags [S], seq 391                              7028417, win 14600, options [mss 1460,sackOK,TS val 59463451 ecr 0,nop,wscale 8]                              , length 0
13:08:40.403119 IP 10.255.255.2.44158 > 198.xxx.xxx.xxx.47662: Flags [R.], seq 0,                               ack 3917028418, win 0, length 0
13:08:40.610922 IP 198.xxx.xxx.xxx.47666 > 10.255.255.2.44158: Flags [S], seq 356                              7829753, win 14600, options [mss 1460,sackOK,TS val 59463504 ecr 0,nop,wscale 8]                              , length 0
13:08:40.610965 IP 10.255.255.2.44158 > 198.xxx.xxx.xxx.47666: Flags [R.], seq 0,                               ack 3567829754, win 0, length 0
13:14:40.253493 IP 198.xxx.xxx.xxx.49045 > 10.255.255.2.44158: Flags [S], seq 522484037, win 14600, options [mss 1460,sackOK,TS val 59553414 ecr 0,nop,wscale 8], length 0
13:14:40.253547 IP 10.255.255.2.44158 > 198.xxx.xxx.xxx.49045: Flags [R.], seq 0, ack 522484038, win 0, length 0
13:14:40.511660 IP 198.xxx.xxx.xxx.49049 > 10.255.255.2.44158: Flags [S], seq 2291546252, win 14600, options [mss 1460,sackOK,TS val 59553479 ecr 0,nop,wscale 8], length 0
13:14:40.511711 IP 10.255.255.2.44158 > 198.xxx.xxx.xxx.49049: Flags [R.], seq 0, ack 2291546253, win 0, length 0
13:14:40.766233 IP 198.xxx.xxx.xxx.49051 > 10.255.255.2.44158: Flags [S], seq 2696496405, win 14600, options [mss 1460,sackOK,TS val 59553543 ecr 0,nop,wscale 8], length 0
13:14:40.766397 IP 10.255.255.2.44158 > 198.xxx.xxx.xxx.49051: Flags [R.], seq 0, ack 2696496406, win 0, length 0

**Comment by Ysurac** [comment]
At least all is redirected to router.
What is the firewall rule you set ? you can get the info via SSH with ```uci show firewall```. I would also neet the result of ```iptables-save```

**Comment by sonnyxp2008** [comment]
root@OpenMPTCProuter:~# uci show firewall
firewall.@defaults[0]=defaults
firewall.@defaults[0].syn_flood='1'
firewall.@defaults[0].forward='REJECT'
firewall.@defaults[0].input='REJECT'
firewall.@defaults[0].output='REJECT'
firewall.zone_lan=zone
firewall.zone_lan.name='lan'
firewall.zone_lan.input='ACCEPT'
firewall.zone_lan.output='ACCEPT'
firewall.zone_lan.forward='ACCEPT'
firewall.zone_lan.auto_helper='0'
firewall.zone_lan.mtu_fix='1'
firewall.zone_lan.network='lan'
firewall.zone_wan=zone
firewall.zone_wan.name='wan'
firewall.zone_wan.input='REJECT'
firewall.zone_wan.output='ACCEPT'
firewall.zone_wan.forward='REJECT'
firewall.zone_wan.masq='1'
firewall.zone_wan.mtu_fix='1'
firewall.zone_wan.network='wan1' 'wan2' '4g'
firewall.@forwarding[0]=forwarding
firewall.@forwarding[0].src='lan'
firewall.@forwarding[0].dest='wan'
firewall.@rule[0]=rule
firewall.@rule[0].name='Allow-DHCP-Renew'
firewall.@rule[0].src='wan'
firewall.@rule[0].proto='udp'
firewall.@rule[0].dest_port='68'
firewall.@rule[0].target='ACCEPT'
firewall.@rule[0].family='ipv4'
firewall.@rule[1]=rule
firewall.@rule[1].name='Allow-Ping'
firewall.@rule[1].src='wan'
firewall.@rule[1].proto='icmp'
firewall.@rule[1].icmp_type='echo-request'
firewall.@rule[1].family='ipv4'
firewall.@rule[1].target='ACCEPT'
firewall.@rule[2]=rule
firewall.@rule[2].name='Allow-IGMP'
firewall.@rule[2].src='wan'
firewall.@rule[2].proto='igmp'
firewall.@rule[2].family='ipv4'
firewall.@rule[2].target='ACCEPT'
firewall.@rule[3]=rule
firewall.@rule[3].name='Allow-DHCPv6'
firewall.@rule[3].src='wan'
firewall.@rule[3].proto='udp'
firewall.@rule[3].src_ip='fc00::/6'
firewall.@rule[3].dest_ip='fc00::/6'
firewall.@rule[3].dest_port='546'
firewall.@rule[3].family='ipv6'
firewall.@rule[3].target='ACCEPT'
firewall.@rule[4]=rule
firewall.@rule[4].name='Allow-MLD'
firewall.@rule[4].src='wan'
firewall.@rule[4].proto='icmp'
firewall.@rule[4].src_ip='fe80::/10'
firewall.@rule[4].icmp_type='130/0' '131/0' '132/0' '143/0'
firewall.@rule[4].family='ipv6'
firewall.@rule[4].target='ACCEPT'
firewall.@rule[5]=rule
firewall.@rule[5].name='Allow-ICMPv6-Forward'
firewall.@rule[5].src='wan'
firewall.@rule[5].dest='*'
firewall.@rule[5].proto='icmp'
firewall.@rule[5].icmp_type='echo-request' 'echo-reply' 'destination-unreachable' 'packet-too-big' 'time-exceeded' 'bad-header' 'unknown-header-type'
firewall.@rule[5].limit='1000/sec'
firewall.@rule[5].family='ipv6'
firewall.@rule[5].target='ACCEPT'
firewall.@rule[6]=rule
firewall.@rule[6].name='Allow-IPSec-ESP'
firewall.@rule[6].src='wan'
firewall.@rule[6].dest='lan'
firewall.@rule[6].proto='esp'
firewall.@rule[6].target='ACCEPT'
firewall.@rule[7]=rule
firewall.@rule[7].name='Allow-ISAKMP'
firewall.@rule[7].src='wan'
firewall.@rule[7].dest='lan'
firewall.@rule[7].dest_port='500'
firewall.@rule[7].proto='udp'
firewall.@rule[7].target='ACCEPT'
firewall.@rule[8]=rule
firewall.@rule[8].name='Support-UDP-Traceroute'
firewall.@rule[8].src='wan'
firewall.@rule[8].dest_port='33434:33689'
firewall.@rule[8].proto='udp'
firewall.@rule[8].family='ipv4'
firewall.@rule[8].target='REJECT'
firewall.@rule[8].enabled='false'
firewall.@include[0]=include
firewall.@include[0].path='/etc/firewall.user'
firewall.@include[0].reload='1'
firewall.@rule[9]=rule
firewall.@rule[9].enabled='1'
firewall.@rule[9].target='ACCEPT'
firewall.@rule[9].name='Allow-All-LAN-to-VPN'
firewall.@rule[9].dest='vpn'
firewall.@rule[9].src='lan'
firewall.zone_vpn=zone
firewall.zone_vpn.name='vpn'
firewall.zone_vpn.masq='1'
firewall.zone_vpn.input='REJECT'
firewall.zone_vpn.forward='ACCEPT'
firewall.zone_vpn.output='ACCEPT'
firewall.zone_vpn.mtu_fix='1'
firewall.zone_vpn.network='glorytun' 'omrvpn' 'omr6in4'
firewall.@rule[10]=rule
firewall.@rule[10].enabled='1'
firewall.@rule[10].target='ACCEPT'
firewall.@rule[10].name='Allow-All-Ping'
firewall.@rule[10].proto='icmp'
firewall.@rule[10].dest='*'
firewall.@rule[10].src='*'
firewall.@rule[10].icmp_type='echo-request'
firewall.@rule[11]=rule
firewall.@rule[11].enabled='1'
firewall.@rule[11].target='ACCEPT'
firewall.@rule[11].name='Allow-VPN-ICMP'
firewall.@rule[11].proto='icmp'
firewall.@rule[11].src='vpn'
firewall.@rule[12]=rule
firewall.@rule[12].enabled='1'
firewall.@rule[12].target='ACCEPT'
firewall.@rule[12].name='Allow-Lan-to-Wan'
firewall.@rule[12].dest='wan'
firewall.@rule[12].src='lan'
firewall.@rule[13]=rule
firewall.@rule[13].enabled='1'
firewall.@rule[13].target='ACCEPT'
firewall.@rule[13].name='ICMPv6-Lan-to-OMR'
firewall.@rule[13].src='lan'
firewall.@rule[13].family='ipv6'
firewall.@rule[13].proto='icmp'
firewall.@rule[13].limit='1000/sec'
firewall.@rule[13].icmp_type='echo-reply destination-unreachable echo-request router-advertisement router-solicitation time-exceeded'
firewall.omr_server=include
firewall.omr_server.path='/etc/firewall.omr-server'
firewall.omr_server.reload='1'
firewall.gre_tunnel=include
firewall.gre_tunnel.path='/etc/firewall.gre-tunnel'
firewall.gre_tunnel.reload='0'
firewall.fwlantovpn=forwarding
firewall.fwlantovpn.src='lan'
firewall.fwlantovpn.dest='vpn'
firewall.blockquicproxy=rule
firewall.blockquicproxy.name='Block QUIC Proxy'
firewall.blockquicproxy.proto='udp'
firewall.blockquicproxy.dest_port='443'
firewall.blockquicproxy.target='DROP'
firewall.blockquicproxy.src='lan'
firewall.blockquicall=rule
firewall.blockquicall.name='Block QUIC All'
firewall.blockquicall.proto='udp'
firewall.blockquicall.src='*'
firewall.blockquicall.dest='*'
firewall.blockquicall.dest_port='443'
firewall.blockquicall.target='DROP'
firewall.allowicmpipv6=rule
firewall.allowicmpipv6.proto='icmp'
firewall.allowicmpipv6.target='ACCEPT'
firewall.allowicmpipv6.src='wan'
firewall.allowicmpipv6.name='Allow IPv6 ICMP'
firewall.allowicmpipv6.family='ipv6'
firewall.allowicmpipv6.icmp_type='neighbour-advertisement neighbour-solicitation router-advertisement router-solicitation'
firewall.allowdhcpv6546=rule
firewall.allowdhcpv6546.target='ACCEPT'
firewall.allowdhcpv6546.src='wan'
firewall.allowdhcpv6546.proto='udp'
firewall.allowdhcpv6546.dest_port='547'
firewall.allowdhcpv6546.name='Allow DHCPv6 (546-to-547)'
firewall.allowdhcpv6546.family='ipv6'
firewall.allowdhcpv6546.src_port='546'
firewall.allowdhcpv6547=rule
firewall.allowdhcpv6547.target='ACCEPT'
firewall.allowdhcpv6547.src='wan'
firewall.allowdhcpv6547.proto='udp'
firewall.allowdhcpv6547.dest_port='546'
firewall.allowdhcpv6547.name='Allow DHCPv6 (547-to-546)'
firewall.allowdhcpv6547.family='ipv6'
firewall.allowdhcpv6547.src_port='547'
firewall.allow_dhcp_request_vpn=rule
firewall.allow_dhcp_request_vpn.name='Allow-DHCP-Request-VPN'
firewall.allow_dhcp_request_vpn.src='vpn'
firewall.allow_dhcp_request_vpn.proto='udp'
firewall.allow_dhcp_request_vpn.dest_port='67'
firewall.allow_dhcp_request_vpn.target='ACCEPT'
firewall.allow_dhcp_request_vpn.family='ipv4'
firewall.v2ray=include
firewall.v2ray.path='/etc/firewall.v2ray-rules'
firewall.v2ray.reload='0'
firewall.omr_bypass=include
firewall.omr_bypass.path='/etc/firewall.omr-bypass'
firewall.omr_bypass.reload='0'
firewall.miniupnpd=include
firewall.miniupnpd.type='script'
firewall.miniupnpd.path='/usr/share/miniupnpd/firewall.include'
firewall.miniupnpd.family='any'
firewall.miniupnpd.reload='1'
firewall.ss_rules=include
firewall.ss_rules.path='/etc/firewall.ss-rules'
firewall.ss_rules.reload='1'
firewall.@redirect[0]=redirect
firewall.@redirect[0].target='DNAT'
firewall.@redirect[0].name='p 44158'
firewall.@redirect[0].src_dport='44158'
firewall.@redirect[0].dest='lan'
firewall.@redirect[0].dest_port='44158'
firewall.@redirect[0].src='vpn'
firewall.@redirect[0].dest_ip='192.168.0.1'
firewall.@nat[0]=nat
firewall.@nat[0].proto='tcp' 'udp'
firewall.@nat[0].src='lan'
firewall.@nat[0].dest_ip='192.168.0.245'
firewall.@nat[0].dest_port='44158'
firewall.@nat[0].target='SNAT'
firewall.@nat[0].snat_ip='192.168.0.1'
firewall.@nat[0].device='eth0'
# Generated by iptables-save v1.8.7 on Wed Jul  7 14:25:00 2021
*raw
:PREROUTING ACCEPT [2574188221:3167717558022]
:OUTPUT ACCEPT [1854792964:2406688705667]
COMMIT
# Completed on Wed Jul  7 14:25:00 2021
# Generated by iptables-save v1.8.7 on Wed Jul  7 14:25:00 2021
*nat
:PREROUTING ACCEPT [69860:29534163]
:INPUT ACCEPT [38060:2766723]
:OUTPUT ACCEPT [111205:8205725]
:POSTROUTING ACCEPT [14655:1078078]
:MINIUPNPD - [0:0]
:MINIUPNPD-POSTROUTING - [0:0]
:postrouting_lan_rule - [0:0]
:postrouting_rule - [0:0]
:postrouting_vpn_rule - [0:0]
:postrouting_wan_rule - [0:0]
:prerouting_lan_rule - [0:0]
:prerouting_rule - [0:0]
:prerouting_vpn_rule - [0:0]
:prerouting_wan_rule - [0:0]
:ssr_def_dst - [0:0]
:ssr_def_forward - [0:0]
:ssr_def_local_out - [0:0]
:ssr_def_pre_src - [0:0]
:ssr_def_src - [0:0]
:zone_lan_postrouting - [0:0]
:zone_lan_prerouting - [0:0]
:zone_vpn_postrouting - [0:0]
:zone_vpn_prerouting - [0:0]
:zone_wan_postrouting - [0:0]
:zone_wan_prerouting - [0:0]
-A PREROUTING -p tcp -j ssr_def_pre_src
-A PREROUTING -m comment --comment "!fw3: Custom prerouting rule chain" -j prero             uting_rule
-A PREROUTING -i br-lan -m comment --comment "!fw3" -j zone_lan_prerouting
-A PREROUTING -i eth1 -m comment --comment "!fw3" -j zone_wan_prerouting
-A PREROUTING -i eth2 -m comment --comment "!fw3" -j zone_wan_prerouting
-A PREROUTING -i eth4 -m comment --comment "!fw3" -j zone_wan_prerouting
-A PREROUTING -i tun0 -m comment --comment "!fw3" -j zone_vpn_prerouting
-A OUTPUT -p tcp -j ssr_def_local_out
-A POSTROUTING -m comment --comment "!fw3: Custom postrouting rule chain" -j pos             trouting_rule
-A POSTROUTING -o br-lan -m comment --comment "!fw3" -j zone_lan_postrouting
-A POSTROUTING -o eth1 -m comment --comment "!fw3" -j zone_wan_postrouting
-A POSTROUTING -o eth2 -m comment --comment "!fw3" -j zone_wan_postrouting
-A POSTROUTING -o eth4 -m comment --comment "!fw3" -j zone_wan_postrouting
-A POSTROUTING -o tun0 -m comment --comment "!fw3" -j zone_vpn_postrouting
-A ssr_def_dst -m mark --mark 0x539 -j RETURN
-A ssr_def_dst -m set --match-set omr_dst_bypass_all dst -j MARK --set-xmark 0x5             39/0xffffffff
-A ssr_def_dst -m set --match-set omr_dst_bypass_eth4 dst -j MARK --set-xmark 0x             5398/0xffffffff
-A ssr_def_dst -m mark --mark 0x5398 -j RETURN
-A ssr_def_dst -m set --match-set omr_dst_bypass_tun0 dst -j MARK --set-xmark 0x             5391200/0xffffffff
-A ssr_def_dst -m mark --mark 0x5391200 -j RETURN
-A ssr_def_dst -m set --match-set omr_dst_bypass_eth2 dst -j MARK --set-xmark 0x             5394/0xffffffff
-A ssr_def_dst -m mark --mark 0x5394 -j RETURN
-A ssr_def_dst -m set --match-set omr_dst_bypass_eth1 dst -j MARK --set-xmark 0x             5393/0xffffffff
-A ssr_def_dst -m mark --mark 0x5393 -j RETURN
-A ssr_def_dst -m set --match-set omr_dst_bypass_br-lan dst -j MARK --set-xmark              0x5396/0xffffffff
-A ssr_def_dst -m mark --mark 0x5396 -j RETURN
-A ssr_def_dst -m set --match-set omr_dst_bypass_lo dst -j MARK --set-xmark 0x53             95/0xffffffff
-A ssr_def_dst -m mark --mark 0x5395 -j RETURN
-A ssr_def_dst -m set --match-set ss_rules_dst_bypass_all dst -j RETURN
-A ssr_def_dst -m set --match-set ssr_def_dst_bypass dst -j RETURN
-A ssr_def_dst -m set --match-set ssr_def_dst_forward dst -j ssr_def_forward
-A ssr_def_dst -m comment --comment "dst_default: forward" -j ssr_def_forward
-A ssr_def_forward -p tcp -j REDIRECT --to-ports 1100-1103
-A ssr_def_local_out -m set --match-set omr_dst_bypass_all dst -j MARK --set-xma             rk 0x539/0xffffffff
-A ssr_def_local_out -m mark --mark 0x539 -j RETURN
-A ssr_def_local_out -m set --match-set omr_dst_bypass_eth4 dst -j MARK --set-xm             ark 0x5398/0xffffffff
-A ssr_def_local_out -m mark --mark 0x5398 -j RETURN
-A ssr_def_local_out -m set --match-set omr_dst_bypass_tun0 dst -j MARK --set-xm             ark 0x5391200/0xffffffff
-A ssr_def_local_out -m mark --mark 0x5391200 -j RETURN
-A ssr_def_local_out -m set --match-set omr_dst_bypass_eth2 dst -j MARK --set-xm             ark 0x5394/0xffffffff
-A ssr_def_local_out -m mark --mark 0x5394 -j RETURN
-A ssr_def_local_out -m set --match-set omr_dst_bypass_eth1 dst -j MARK --set-xm             ark 0x5393/0xffffffff
-A ssr_def_local_out -m mark --mark 0x5393 -j RETURN
-A ssr_def_local_out -m set --match-set omr_dst_bypass_br-lan dst -j MARK --set-             xmark 0x5396/0xffffffff
-A ssr_def_local_out -m mark --mark 0x5396 -j RETURN
-A ssr_def_local_out -m set --match-set omr_dst_bypass_lo dst -j MARK --set-xmar             k 0x5395/0xffffffff
-A ssr_def_local_out -m mark --mark 0x5395 -j RETURN
-A ssr_def_local_out -m set --match-set ssr_def_dst_bypass dst -j RETURN
-A ssr_def_local_out -m set --match-set ss_rules_dst_bypass_all dst -j RETURN
-A ssr_def_local_out -m set --match-set ssr_def_dst_bypass_ dst -j RETURN
-A ssr_def_local_out -m mark --mark 0x539 -j RETURN
-A ssr_def_local_out -p tcp -m comment --comment "local_default: forward" -j ssr             _def_forward
-A ssr_def_pre_src -m set --match-set omr_dst_bypass_all dst -j MARK --set-xmark              0x539/0xffffffff
-A ssr_def_pre_src -m mark --mark 0x539 -j RETURN
-A ssr_def_pre_src -m set --match-set omr_dst_bypass_eth4 dst -j MARK --set-xmar             k 0x5398/0xffffffff
-A ssr_def_pre_src -m mark --mark 0x5398 -j RETURN
-A ssr_def_pre_src -m set --match-set omr_dst_bypass_tun0 dst -j MARK --set-xmar             k 0x5391200/0xffffffff
-A ssr_def_pre_src -m mark --mark 0x5391200 -j RETURN
-A ssr_def_pre_src -m set --match-set omr_dst_bypass_eth2 dst -j MARK --set-xmar             k 0x5394/0xffffffff
-A ssr_def_pre_src -m mark --mark 0x5394 -j RETURN
-A ssr_def_pre_src -m set --match-set omr_dst_bypass_eth1 dst -j MARK --set-xmar             k 0x5393/0xffffffff
-A ssr_def_pre_src -m mark --mark 0x5393 -j RETURN
-A ssr_def_pre_src -m set --match-set omr_dst_bypass_br-lan dst -j MARK --set-xm             ark 0x5396/0xffffffff
-A ssr_def_pre_src -m mark --mark 0x5396 -j RETURN
-A ssr_def_pre_src -m set --match-set omr_dst_bypass_lo dst -j MARK --set-xmark              0x5395/0xffffffff
-A ssr_def_pre_src -m mark --mark 0x5395 -j RETURN
-A ssr_def_pre_src -m set --match-set ssr_def_dst_bypass_ dst -j RETURN
-A ssr_def_pre_src -m set --match-set ss_rules_dst_bypass_all dst -j MARK --set-             xmark 0x539/0xffffffff
-A ssr_def_pre_src -m set --match-set ss_rules_dst_bypass_all dst -j RETURN
-A ssr_def_pre_src -m set --match-set ssr_def_dst_bypass dst -j RETURN
-A ssr_def_pre_src -m mark --mark 0x539 -j RETURN
-A ssr_def_pre_src -p tcp -j ssr_def_src
-A ssr_def_src -m set --match-set ssr_def_src_bypass src -j RETURN
-A ssr_def_src -m set --match-set ssr_def_src_forward src -j ssr_def_forward
-A ssr_def_src -m set --match-set ssr_def_src_checkdst src -j ssr_def_dst
-A ssr_def_src -m comment --comment "src_default: forward" -j ssr_def_forward
-A zone_lan_postrouting -m comment --comment "!fw3: Custom lan postrouting rule              chain" -j postrouting_lan_rule
-A zone_lan_postrouting -d 192.168.0.245/32 -o eth0 -p tcp -m tcp --dport 44158              -m comment --comment "!fw3: @nat[0]" -j SNAT --to-source 192.168.0.1
-A zone_lan_postrouting -d 192.168.0.245/32 -o eth0 -p udp -m udp --dport 44158              -m comment --comment "!fw3: @nat[0]" -j SNAT --to-source 192.168.0.1
-A zone_lan_prerouting -m comment --comment "!fw3: Custom lan prerouting rule ch             ain" -j prerouting_lan_rule
-A zone_vpn_postrouting -m comment --comment "!fw3: Custom vpn postrouting rule              chain" -j postrouting_vpn_rule
-A zone_vpn_postrouting -j MINIUPNPD-POSTROUTING
-A zone_vpn_postrouting -m comment --comment "!fw3" -j MASQUERADE
-A zone_vpn_prerouting -m comment --comment "!fw3: Custom vpn prerouting rule ch             ain" -j prerouting_vpn_rule
-A zone_vpn_prerouting -p tcp -m tcp --dport 44158 -m comment --comment "!fw3: p             rova 44158" -j DNAT --to-destination 192.168.0.1:44158
-A zone_vpn_prerouting -p udp -m udp --dport 44158 -m comment --comment "!fw3: p             rova 44158" -j DNAT --to-destination 192.168.0.1:44158
-A zone_vpn_prerouting -j MINIUPNPD
-A zone_wan_postrouting -m comment --comment "!fw3: Custom wan postrouting rule              chain" -j postrouting_wan_rule
-A zone_wan_postrouting -m comment --comment "!fw3" -j MASQUERADE
-A zone_wan_prerouting -m comment --comment "!fw3: Custom wan prerouting rule ch             ain" -j prerouting_wan_rule
COMMIT
# Completed on Wed Jul  7 14:25:00 2021
# Generated by iptables-save v1.8.7 on Wed Jul  7 14:25:00 2021
*mangle
:PREROUTING ACCEPT [19134268:22290622444]
:INPUT ACCEPT [14731359:17772717523]
:FORWARD ACCEPT [4401131:4517847057]
:OUTPUT ACCEPT [13093489:17530099615]
:POSTROUTING ACCEPT [17470400:22022042473]
:dscp_mark - [0:0]
:dscp_output - [0:0]
:dscp_postrouting - [0:0]
:dscp_prerouting - [0:0]
:omr-bypass - [0:0]
:omr-bypass-dpi - [0:0]
:omr-bypass-local - [0:0]
:omr-gre-tunnel - [0:0]
-A PREROUTING -m addrtype ! --dst-type LOCAL -j omr-bypass
-A PREROUTING -i br-lan -j dscp_prerouting
-A PREROUTING -m addrtype ! --dst-type LOCAL -j omr-gre-tunnel
-A PREROUTING -m set --match-set ss_rules_dst_bypass_all dst -j MARK --set-xmark              0x539/0xffffffff
-A PREROUTING -i br-lan -j dscp_mark
-A PREROUTING -m addrtype ! --dst-type LOCAL -j omr-bypass-dpi
-A FORWARD -o br-lan -p tcp -m tcp --tcp-flags SYN,RST SYN -m comment --comment              "!fw3: Zone lan MTU fixing" -j TCPMSS --clamp-mss-to-pmtu
-A FORWARD -i br-lan -p tcp -m tcp --tcp-flags SYN,RST SYN -m comment --comment              "!fw3: Zone lan MTU fixing" -j TCPMSS --clamp-mss-to-pmtu
-A FORWARD -o eth1 -p tcp -m tcp --tcp-flags SYN,RST SYN -m comment --comment "!             fw3: Zone wan MTU fixing" -j TCPMSS --clamp-mss-to-pmtu
-A FORWARD -i eth1 -p tcp -m tcp --tcp-flags SYN,RST SYN -m comment --comment "!             fw3: Zone wan MTU fixing" -j TCPMSS --clamp-mss-to-pmtu
-A FORWARD -o eth2 -p tcp -m tcp --tcp-flags SYN,RST SYN -m comment --comment "!             fw3: Zone wan MTU fixing" -j TCPMSS --clamp-mss-to-pmtu
-A FORWARD -i eth2 -p tcp -m tcp --tcp-flags SYN,RST SYN -m comment --comment "!             fw3: Zone wan MTU fixing" -j TCPMSS --clamp-mss-to-pmtu
-A FORWARD -o eth4 -p tcp -m tcp --tcp-flags SYN,RST SYN -m comment --comment "!             fw3: Zone wan MTU fixing" -j TCPMSS --clamp-mss-to-pmtu
-A FORWARD -i eth4 -p tcp -m tcp --tcp-flags SYN,RST SYN -m comment --comment "!             fw3: Zone wan MTU fixing" -j TCPMSS --clamp-mss-to-pmtu
-A FORWARD -o tun0 -p tcp -m tcp --tcp-flags SYN,RST SYN -m comment --comment "!             fw3: Zone vpn MTU fixing" -j TCPMSS --clamp-mss-to-pmtu
-A FORWARD -i tun0 -p tcp -m tcp --tcp-flags SYN,RST SYN -m comment --comment "!             fw3: Zone vpn MTU fixing" -j TCPMSS --clamp-mss-to-pmtu
-A OUTPUT -m addrtype ! --dst-type LOCAL -j omr-bypass-local
-A OUTPUT -j dscp_output
-A OUTPUT -m addrtype ! --dst-type LOCAL -j omr-bypass-dpi
-A POSTROUTING -j dscp_postrouting
-A POSTROUTING -j dscp_mark
-A POSTROUTING -m addrtype --dst-type LOCAL -j omr-bypass-dpi
-A dscp_mark -m comment --comment cs4 -m dscp --dscp 0x20 -j MARK --set-xmark 0x             7874756e/0xffffffff
-A dscp_mark -m comment --comment cs5 -m dscp --dscp 0x28 -j MARK --set-xmark 0x             7874756e/0xffffffff
-A dscp_mark -m comment --comment cs6 -m dscp --dscp 0x30 -j MARK --set-xmark 0x             7874756e/0xffffffff
-A dscp_mark -m comment --comment cs7 -m dscp --dscp 0x38 -j MARK --set-xmark 0x             7874756e/0xffffffff
-A dscp_output -o tun0 -j DSCP --set-dscp 0x30
-A dscp_postrouting -m set --match-set omr_dscp-cs0 src,dst -m comment --comment              cs0 -j DSCP --set-dscp 0x00
-A dscp_postrouting -m set --match-set omr_dscp-cs0 src,dst -m comment --comment              cs0 -j RETURN
-A dscp_postrouting -m set --match-set omr_dscp-cs1 src,dst -m comment --comment              cs1 -j DSCP --set-dscp 0x08
-A dscp_postrouting -m set --match-set omr_dscp-cs1 src,dst -m comment --comment              cs1 -j RETURN
-A dscp_postrouting -m set --match-set omr_dscp-cs2 src,dst -m comment --comment              cs2 -j DSCP --set-dscp 0x10
-A dscp_postrouting -m set --match-set omr_dscp-cs2 src,dst -m comment --comment              cs2 -j RETURN
-A dscp_postrouting -m set --match-set omr_dscp-cs3 src,dst -m comment --comment              cs3 -j DSCP --set-dscp 0x18
-A dscp_postrouting -m set --match-set omr_dscp-cs3 src,dst -m comment --comment              cs3 -j RETURN
-A dscp_postrouting -m set --match-set omr_dscp-cs4 src,dst -m comment --comment              cs4 -j DSCP --set-dscp 0x20
-A dscp_postrouting -m set --match-set omr_dscp-cs4 src,dst -m comment --comment              cs4 -j RETURN
-A dscp_postrouting -m set --match-set omr_dscp-cs5 src,dst -m comment --comment              cs5 -j DSCP --set-dscp 0x28
-A dscp_postrouting -m set --match-set omr_dscp-cs5 src,dst -m comment --comment              cs5 -j RETURN
-A dscp_postrouting -m set --match-set omr_dscp-cs6 src,dst -m comment --comment              cs6 -j DSCP --set-dscp 0x30
-A dscp_postrouting -m set --match-set omr_dscp-cs6 src,dst -m comment --comment              cs6 -j RETURN
-A dscp_postrouting -m set --match-set omr_dscp-cs7 src,dst -m comment --comment              cs7 -j DSCP --set-dscp 0x38
-A dscp_postrouting -m set --match-set omr_dscp-cs7 src,dst -m comment --comment              cs7 -j RETURN
-A dscp_postrouting -m set --match-set omr_dscp-ef src,dst -m comment --comment              ef -j DSCP --set-dscp 0x2e
-A dscp_postrouting -m set --match-set omr_dscp-ef src,dst -m comment --comment              ef -j RETURN
-A dscp_postrouting -p icmp -m comment --comment ICMP -j DSCP --set-dscp 0x38
-A dscp_postrouting -p icmp -m comment --comment ICMP -j RETURN
-A dscp_postrouting -p udp -m multiport --sports 53,123,5353 -m multiport --dpor             ts 0:65535 -m comment --comment "DNS udp and NTP" -j DSCP --set-dscp 0x20
-A dscp_postrouting -p udp -m multiport --sports 53,123,5353 -m multiport --dpor             ts 0:65535 -m comment --comment "DNS udp and NTP" -j RETURN
-A dscp_postrouting -p tcp -m multiport --sports 53,5353 -m multiport --dports 0             :65535 -m comment --comment "DNS tcp" -j DSCP --set-dscp 0x20
-A dscp_postrouting -p tcp -m multiport --sports 53,5353 -m multiport --dports 0             :65535 -m comment --comment "DNS tcp" -j RETURN
-A dscp_postrouting -p tcp -m multiport --sports 0:65535 -m multiport --dports 6             5500 -m comment --comment "OMR API" -j DSCP --set-dscp 0x20
-A dscp_postrouting -p tcp -m multiport --sports 0:65535 -m multiport --dports 6             5500 -m comment --comment "OMR API" -j RETURN
-A dscp_postrouting -p tcp -m multiport --sports 0:65535 -m multiport --dports 6             5001,65301,65401,65011 -m comment --comment "OMR vpn" -j DSCP --set-dscp 0x38
-A dscp_postrouting -p tcp -m multiport --sports 0:65535 -m multiport --dports 6             5001,65301,65401,65011 -m comment --comment "OMR vpn" -j RETURN
-A dscp_postrouting -p udp -m multiport --sports 0:65535 -m multiport --dports 6             5001,65301 -m comment --comment "OMR vpn" -j DSCP --set-dscp 0x38
-A dscp_postrouting -p udp -m multiport --sports 0:65535 -m multiport --dports 6             5001,65301 -m comment --comment "OMR vpn" -j RETURN
-A dscp_postrouting -p tcp -m multiport --sports 0:65535 -m multiport --dports 6             5101,65228 -m comment --comment "OMR proxy" -j DSCP --set-dscp 0x30
-A dscp_postrouting -p tcp -m multiport --sports 0:65535 -m multiport --dports 6             5101,65228 -m comment --comment "OMR proxy" -j RETURN
-A dscp_prerouting -m set --match-set omr_dscp-cs0 src,dst -m comment --comment              cs0 -j DSCP --set-dscp 0x00
-A dscp_prerouting -m set --match-set omr_dscp-cs0 src,dst -m comment --comment              cs0 -j RETURN
-A dscp_prerouting -m set --match-set omr_dscp-cs1 src,dst -m comment --comment              cs1 -j DSCP --set-dscp 0x08
-A dscp_prerouting -m set --match-set omr_dscp-cs1 src,dst -m comment --comment              cs1 -j RETURN
-A dscp_prerouting -m set --match-set omr_dscp-cs2 src,dst -m comment --comment              cs2 -j DSCP --set-dscp 0x10
-A dscp_prerouting -m set --match-set omr_dscp-cs2 src,dst -m comment --comment              cs2 -j RETURN
-A dscp_prerouting -m set --match-set omr_dscp-cs3 src,dst -m comment --comment              cs3 -j DSCP --set-dscp 0x18
-A dscp_prerouting -m set --match-set omr_dscp-cs3 src,dst -m comment --comment              cs3 -j RETURN
-A dscp_prerouting -m set --match-set omr_dscp-cs4 src,dst -m comment --comment              cs4 -j DSCP --set-dscp 0x20
-A dscp_prerouting -m set --match-set omr_dscp-cs4 src,dst -m comment --comment              cs4 -j RETURN
-A dscp_prerouting -m set --match-set omr_dscp-cs5 src,dst -m comment --comment              cs5 -j DSCP --set-dscp 0x28
-A dscp_prerouting -m set --match-set omr_dscp-cs5 src,dst -m comment --comment              cs5 -j RETURN
-A dscp_prerouting -m set --match-set omr_dscp-cs6 src,dst -m comment --comment              cs6 -j DSCP --set-dscp 0x30
-A dscp_prerouting -m set --match-set omr_dscp-cs6 src,dst -m comment --comment              cs6 -j RETURN
-A dscp_prerouting -m set --match-set omr_dscp-cs7 src,dst -m comment --comment              cs7 -j DSCP --set-dscp 0x38
-A dscp_prerouting -m set --match-set omr_dscp-cs7 src,dst -m comment --comment              cs7 -j RETURN
-A dscp_prerouting -m set --match-set omr_dscp-ef src,dst -m comment --comment e             f -j DSCP --set-dscp 0x2e
-A dscp_prerouting -m set --match-set omr_dscp-ef src,dst -m comment --comment e             f -j RETURN
-A dscp_prerouting -p icmp -m comment --comment ICMP -j DSCP --set-dscp 0x38
-A dscp_prerouting -p icmp -m comment --comment ICMP -j RETURN
-A dscp_prerouting -p udp -m multiport --sports 53,123,5353 -m multiport --dport             s 0:65535 -m comment --comment "DNS udp and NTP" -j DSCP --set-dscp 0x20
-A dscp_prerouting -p udp -m multiport --sports 53,123,5353 -m multiport --dport             s 0:65535 -m comment --comment "DNS udp and NTP" -j RETURN
-A dscp_prerouting -p tcp -m multiport --sports 53,5353 -m multiport --dports 0:             65535 -m comment --comment "DNS tcp" -j DSCP --set-dscp 0x20
-A dscp_prerouting -p tcp -m multiport --sports 53,5353 -m multiport --dports 0:             65535 -m comment --comment "DNS tcp" -j RETURN
-A dscp_prerouting -p tcp -m multiport --sports 0:65535 -m multiport --dports 65             500 -m comment --comment "OMR API" -j DSCP --set-dscp 0x20
-A dscp_prerouting -p tcp -m multiport --sports 0:65535 -m multiport --dports 65             500 -m comment --comment "OMR API" -j RETURN
-A dscp_prerouting -p tcp -m multiport --sports 0:65535 -m multiport --dports 65             001,65301,65401,65011 -m comment --comment "OMR vpn" -j DSCP --set-dscp 0x38
-A dscp_prerouting -p tcp -m multiport --sports 0:65535 -m multiport --dports 65             001,65301,65401,65011 -m comment --comment "OMR vpn" -j RETURN
-A dscp_prerouting -p udp -m multiport --sports 0:65535 -m multiport --dports 65             001,65301 -m comment --comment "OMR vpn" -j DSCP --set-dscp 0x38
-A dscp_prerouting -p udp -m multiport --sports 0:65535 -m multiport --dports 65             001,65301 -m comment --comment "OMR vpn" -j RETURN
-A dscp_prerouting -p tcp -m multiport --sports 0:65535 -m multiport --dports 65             101,65228 -m comment --comment "OMR proxy" -j DSCP --set-dscp 0x30
-A dscp_prerouting -p tcp -m multiport --sports 0:65535 -m multiport --dports 65             101,65228 -m comment --comment "OMR proxy" -j RETURN
-A omr-bypass -m set --match-set omr_dst_bypass_eth4 dst -j MARK --set-xmark 0x5             398/0xffffffff
-A omr-bypass -m set --match-set omr_dst_bypass_tun0 dst -j MARK --set-xmark 0x5             391200/0xffffffff
-A omr-bypass -m set --match-set omr_dst_bypass_eth2 dst -j MARK --set-xmark 0x5             394/0xffffffff
-A omr-bypass -m set --match-set omr_dst_bypass_eth1 dst -j MARK --set-xmark 0x5             393/0xffffffff
-A omr-bypass -m set --match-set omr_dst_bypass_br-lan dst -j MARK --set-xmark 0             x5396/0xffffffff
-A omr-bypass -m set --match-set omr_dst_bypass_lo dst -j MARK --set-xmark 0x539             5/0xffffffff
-A omr-bypass -m set --match-set omr_dst_bypass_all dst -j MARK --set-xmark 0x53             9/0xffffffff
-A omr-bypass-local -m set --match-set omr_dst_bypass_eth4 dst -j MARK --set-xma             rk 0x5398/0xffffffff
-A omr-bypass-local -m set --match-set omr_dst_bypass_tun0 dst -j MARK --set-xma             rk 0x5391200/0xffffffff
-A omr-bypass-local -m set --match-set omr_dst_bypass_eth2 dst -j MARK --set-xma             rk 0x5394/0xffffffff
-A omr-bypass-local -m set --match-set omr_dst_bypass_eth1 dst -j MARK --set-xma             rk 0x5393/0xffffffff
-A omr-bypass-local -m set --match-set omr_dst_bypass_br-lan dst -j MARK --set-x             mark 0x5396/0xffffffff
-A omr-bypass-local -m set --match-set omr_dst_bypass_lo dst -j MARK --set-xmark              0x5395/0xffffffff
-A omr-bypass-local -m set --match-set omr_dst_bypass_all dst -j MARK --set-xmar             k 0x539/0xffffffff
COMMIT
# Completed on Wed Jul  7 14:25:00 2021
# Generated by iptables-save v1.8.7 on Wed Jul  7 14:25:00 2021
*filter
:INPUT DROP [0:0]
:FORWARD DROP [0:0]
:OUTPUT DROP [0:0]
:MINIUPNPD - [0:0]
:forwarding_lan_rule - [0:0]
:forwarding_rule - [0:0]
:forwarding_vpn_rule - [0:0]
:forwarding_wan_rule - [0:0]
:input_lan_rule - [0:0]
:input_rule - [0:0]
:input_vpn_rule - [0:0]
:input_wan_rule - [0:0]
:output_lan_rule - [0:0]
:output_rule - [0:0]
:output_vpn_rule - [0:0]
:output_wan_rule - [0:0]
:reject - [0:0]
:syn_flood - [0:0]
:zone_lan_dest_ACCEPT - [0:0]
:zone_lan_forward - [0:0]
:zone_lan_input - [0:0]
:zone_lan_output - [0:0]
:zone_lan_src_ACCEPT - [0:0]
:zone_vpn_dest_ACCEPT - [0:0]
:zone_vpn_forward - [0:0]
:zone_vpn_input - [0:0]
:zone_vpn_output - [0:0]
:zone_vpn_src_REJECT - [0:0]
:zone_wan_dest_ACCEPT - [0:0]
:zone_wan_dest_REJECT - [0:0]
:zone_wan_forward - [0:0]
:zone_wan_input - [0:0]
:zone_wan_output - [0:0]
:zone_wan_src_REJECT - [0:0]
-A INPUT -i lo -m comment --comment "!fw3" -j ACCEPT
-A INPUT -m comment --comment "!fw3: Custom input rule chain" -j input_rule
-A INPUT -m conntrack --ctstate RELATED,ESTABLISHED -m comment --comment "!fw3"              -j ACCEPT
-A INPUT -p tcp -m tcp --tcp-flags FIN,SYN,RST,ACK SYN -m comment --comment "!fw             3" -j syn_flood
-A INPUT -i br-lan -m comment --comment "!fw3" -j zone_lan_input
-A INPUT -i eth1 -m comment --comment "!fw3" -j zone_wan_input
-A INPUT -i eth2 -m comment --comment "!fw3" -j zone_wan_input
-A INPUT -i eth4 -m comment --comment "!fw3" -j zone_wan_input
-A INPUT -i tun0 -m comment --comment "!fw3" -j zone_vpn_input
-A INPUT -m comment --comment "!fw3" -j reject
-A FORWARD -m comment --comment "!fw3: Custom forwarding rule chain" -j forwardi             ng_rule
-A FORWARD -m conntrack --ctstate RELATED,ESTABLISHED -m comment --comment "!fw3             " -j ACCEPT
-A FORWARD -p icmp -m icmp --icmp-type 8 -m comment --comment "!fw3: Allow-All-P             ing" -j ACCEPT
-A FORWARD -p udp -m udp --dport 443 -m comment --comment "!fw3: Block QUIC All"              -j DROP
-A FORWARD -i br-lan -m comment --comment "!fw3" -j zone_lan_forward
-A FORWARD -i eth1 -m comment --comment "!fw3" -j zone_wan_forward
-A FORWARD -i eth2 -m comment --comment "!fw3" -j zone_wan_forward
-A FORWARD -i eth4 -m comment --comment "!fw3" -j zone_wan_forward
-A FORWARD -i tun0 -m comment --comment "!fw3" -j zone_vpn_forward
-A FORWARD -m comment --comment "!fw3" -j reject
-A OUTPUT -o lo -m comment --comment "!fw3" -j ACCEPT
-A OUTPUT -m comment --comment "!fw3: Custom output rule chain" -j output_rule
-A OUTPUT -m conntrack --ctstate RELATED,ESTABLISHED -m comment --comment "!fw3"              -j ACCEPT
-A OUTPUT -o br-lan -m comment --comment "!fw3" -j zone_lan_output
-A OUTPUT -o eth1 -m comment --comment "!fw3" -j zone_wan_output
-A OUTPUT -o eth2 -m comment --comment "!fw3" -j zone_wan_output
-A OUTPUT -o eth4 -m comment --comment "!fw3" -j zone_wan_output
-A OUTPUT -o tun0 -m comment --comment "!fw3" -j zone_vpn_output
-A OUTPUT -m comment --comment "!fw3" -j reject
-A reject -p tcp -m comment --comment "!fw3" -j REJECT --reject-with tcp-reset
-A reject -m comment --comment "!fw3" -j REJECT --reject-with icmp-port-unreacha             ble
-A syn_flood -p tcp -m tcp --tcp-flags FIN,SYN,RST,ACK SYN -m limit --limit 25/s             ec --limit-burst 50 -m comment --comment "!fw3" -j RETURN
-A syn_flood -m comment --comment "!fw3" -j DROP
-A zone_lan_dest_ACCEPT -o br-lan -m comment --comment "!fw3" -j ACCEPT
-A zone_lan_forward -m comment --comment "!fw3: Custom lan forwarding rule chain             " -j forwarding_lan_rule
-A zone_lan_forward -p tcp -m comment --comment "!fw3: Allow-All-LAN-to-VPN" -j              zone_vpn_dest_ACCEPT
-A zone_lan_forward -p udp -m comment --comment "!fw3: Allow-All-LAN-to-VPN" -j              zone_vpn_dest_ACCEPT
-A zone_lan_forward -p tcp -m comment --comment "!fw3: Allow-Lan-to-Wan" -j zone             _wan_dest_ACCEPT
-A zone_lan_forward -p udp -m comment --comment "!fw3: Allow-Lan-to-Wan" -j zone             _wan_dest_ACCEPT
-A zone_lan_forward -m comment --comment "!fw3: Zone lan to wan forwarding polic             y" -j zone_wan_dest_ACCEPT
-A zone_lan_forward -m comment --comment "!fw3: Zone lan to vpn forwarding polic             y" -j zone_vpn_dest_ACCEPT
-A zone_lan_forward -m conntrack --ctstate DNAT -m comment --comment "!fw3: Acce             pt port forwards" -j ACCEPT
-A zone_lan_forward -m comment --comment "!fw3" -j zone_lan_dest_ACCEPT
-A zone_lan_input -m comment --comment "!fw3: Custom lan input rule chain" -j in             put_lan_rule
-A zone_lan_input -p udp -m udp --dport 443 -m comment --comment "!fw3: Block QU             IC Proxy" -j DROP
-A zone_lan_input -m conntrack --ctstate DNAT -m comment --comment "!fw3: Accept              port redirections" -j ACCEPT
-A zone_lan_input -m comment --comment "!fw3" -j zone_lan_src_ACCEPT
-A zone_lan_output -m comment --comment "!fw3: Custom lan output rule chain" -j              output_lan_rule
-A zone_lan_output -m comment --comment "!fw3" -j zone_lan_dest_ACCEPT
-A zone_lan_src_ACCEPT -i br-lan -m conntrack --ctstate NEW,UNTRACKED -m comment              --comment "!fw3" -j ACCEPT
-A zone_vpn_dest_ACCEPT -o tun0 -m conntrack --ctstate INVALID -m comment --comm             ent "!fw3: Prevent NAT leakage" -j DROP
-A zone_vpn_dest_ACCEPT -o tun0 -m comment --comment "!fw3" -j ACCEPT
-A zone_vpn_forward -m comment --comment "!fw3: Custom vpn forwarding rule chain             " -j forwarding_vpn_rule
-A zone_vpn_forward -m conntrack --ctstate DNAT -m comment --comment "!fw3: Acce             pt port forwards" -j ACCEPT
-A zone_vpn_forward -j MINIUPNPD
-A zone_vpn_forward -m comment --comment "!fw3" -j zone_vpn_dest_ACCEPT
-A zone_vpn_input -m comment --comment "!fw3: Custom vpn input rule chain" -j in             put_vpn_rule
-A zone_vpn_input -p icmp -m comment --comment "!fw3: Allow-VPN-ICMP" -j ACCEPT
-A zone_vpn_input -p udp -m udp --dport 67 -m comment --comment "!fw3: Allow-DHC             P-Request-VPN" -j ACCEPT
-A zone_vpn_input -m conntrack --ctstate DNAT -m comment --comment "!fw3: Accept              port redirections" -j ACCEPT
-A zone_vpn_input -j MINIUPNPD
-A zone_vpn_input -m comment --comment "!fw3" -j zone_vpn_src_REJECT
-A zone_vpn_output -m comment --comment "!fw3: Custom vpn output rule chain" -j              output_vpn_rule
-A zone_vpn_output -m comment --comment "!fw3" -j zone_vpn_dest_ACCEPT
-A zone_vpn_src_REJECT -i tun0 -m comment --comment "!fw3" -j reject
-A zone_wan_dest_ACCEPT -o eth1 -m conntrack --ctstate INVALID -m comment --comm             ent "!fw3: Prevent NAT leakage" -j DROP
-A zone_wan_dest_ACCEPT -o eth1 -m comment --comment "!fw3" -j ACCEPT
-A zone_wan_dest_ACCEPT -o eth2 -m conntrack --ctstate INVALID -m comment --comm             ent "!fw3: Prevent NAT leakage" -j DROP
-A zone_wan_dest_ACCEPT -o eth2 -m comment --comment "!fw3" -j ACCEPT
-A zone_wan_dest_ACCEPT -o eth4 -m conntrack --ctstate INVALID -m comment --comm             ent "!fw3: Prevent NAT leakage" -j DROP
-A zone_wan_dest_ACCEPT -o eth4 -m comment --comment "!fw3" -j ACCEPT
-A zone_wan_dest_REJECT -o eth1 -m comment --comment "!fw3" -j reject
-A zone_wan_dest_REJECT -o eth2 -m comment --comment "!fw3" -j reject
-A zone_wan_dest_REJECT -o eth4 -m comment --comment "!fw3" -j reject
-A zone_wan_forward -m comment --comment "!fw3: Custom wan forwarding rule chain             " -j forwarding_wan_rule
-A zone_wan_forward -p esp -m comment --comment "!fw3: Allow-IPSec-ESP" -j zone_             lan_dest_ACCEPT
-A zone_wan_forward -p udp -m udp --dport 500 -m comment --comment "!fw3: Allow-             ISAKMP" -j zone_lan_dest_ACCEPT
-A zone_wan_forward -m conntrack --ctstate DNAT -m comment --comment "!fw3: Acce             pt port forwards" -j ACCEPT
-A zone_wan_forward -m comment --comment "!fw3" -j zone_wan_dest_REJECT
-A zone_wan_input -m comment --comment "!fw3: Custom wan input rule chain" -j in             put_wan_rule
-A zone_wan_input -p udp -m udp --dport 68 -m comment --comment "!fw3: Allow-DHC             P-Renew" -j ACCEPT
-A zone_wan_input -p icmp -m icmp --icmp-type 8 -m comment --comment "!fw3: Allo             w-Ping" -j ACCEPT
-A zone_wan_input -p igmp -m comment --comment "!fw3: Allow-IGMP" -j ACCEPT
-A zone_wan_input -m conntrack --ctstate DNAT -m comment --comment "!fw3: Accept              port redirections" -j ACCEPT
-A zone_wan_input -m comment --comment "!fw3" -j zone_wan_src_REJECT
-A zone_wan_output -m comment --comment "!fw3: Custom wan output rule chain" -j              output_wan_rule
-A zone_wan_output -m comment --comment "!fw3" -j zone_wan_dest_ACCEPT
-A zone_wan_src_REJECT -i eth1 -m comment --comment "!fw3" -j reject
-A zone_wan_src_REJECT -i eth2 -m comment --comment "!fw3" -j reject
-A zone_wan_src_REJECT -i eth4 -m comment --comment "!fw3" -j reject
COMMIT
