### DISCUSSION TITLE
Port forwarding impossible

### DISCUSSION THREAD

**Discussion by MatzDerTrainer** [Ysurac/openmptcprouter#3860] [Q&A]
Hello, I have another question.
I tried opening ports for Teredo, but no matter how I tried, be it v2/ray or via VPN, the ports remained closed during the subsequent test.
After some difficulties, the port forwarding for my NAS finally worked. I set up port forwarding for Teredo the same way I did for the NAS, but as I said, it didn't work.
The following ports are involved: 3544, 3074, 53, 80, 500, and 4500. Only port 80 could be opened.

**Comment by Ysurac** [comment]
Follow https://github.com/Ysurac/openmptcprouter/wiki/Port-forwarding#debug

**Reply by MatzDerTrainer** [reply]
> Follow https://github.com/Ysurac/openmptcprouter/wiki/Port-forwarding#debug

I followed this tutorial but as described the ports remained closed only port 80 was open afterwards.

**Reply by Ysurac** [reply]
So what do you have in rules files and what is the result of tcpdump ?

**Reply by MatzDerTrainer** [reply]
> So what do you have in rules files and what is the result of tcpdump ?

Here's what it says under rules:
I removed the IP addresses, they are there normally

DHCPFwd(ACCEPT) $FW vpn
#
# Redirect all port from 1 to 64999 to the VPN client from the network
#
DNAT net vpn:$OMR_ADDR tcp 1-64999
DNAT net vpn:$OMR_ADDR udp 1-64999
ACCEPT net $FW udp 65311 #OMR openmptcprouter open wireguard port udp
ACCEPT net $FW tcp 8579 #OMR openmptcprouter open router 8579 port tcp --- V2Ray to :8579
ACCEPT net $FW udp 8579 #OMR openmptcprouter open router 8579 port udp --- V2Ray to :8579
ACCEPT net $FW udp 4500 # OMR openmptcprouter open router 4500 port udp --- V2Ray to :4500
ACCEPT net $FW tcp 3074 #OMR openmptcprouter open router 3074 port tcp --- V2Ray to :3074
ACCEPT net $FW udp 3074 #OMR openmptcprouter open router 3074 port udp --- V2Ray to :3074
ACCEPT net $FW tcp 53 # OMR openmptcprouter open router 53 port tcp --- V2Ray to :53
ACCEPT net $FW udp 53 # OMR openmptcprouter open router 53 port udp --- V2Ray to :53
ACCEPT net $FW tcp 80 # OMR openmptcprouter open router 80 port tcp --- V2Ray to :80
ACCEPT net $FW udp 500 # OMR openmptcprouter open router 500 port udp --- V2Ray to :500
ACCEPT net $FW udp 3544 # OMR openmptcprouter open router 3544 port udp --- V2Ray to :3544

I'm attaching a screenshot of the TCP dump.
I've disabled port forwarding via V2Ray for the TCP dump.
![IMG_3409](https://github.com/user-attachments/assets/9369435d-978e-4301-b5c5-62ac8486aad1)

**Reply by Ysurac** [reply]
As you are using V2ray, it's normal there is nothing on tun0, you have to use "-i any".
If there is still nothing, did you try without using V2Ray ?

And why do you have: 
```
DNAT net vpn:$OMR_ADDR tcp 1-64999
DNAT net vpn:$OMR_ADDR udp 1-64999
```
You are already redirecting all ports to the router. You may have an issue in /etc/shorewall/params.vpn

**Reply by MatzDerTrainer** [reply]
> As you are using V2ray, it's normal there is nothing on tun0, you have to use "-i any". If there is still nothing, did you try without using V2Ray ?
> 
> And why do you have:
> 
> ```
> DNAT net vpn:$OMR_ADDR tcp 1-64999
> DNAT net vpn:$OMR_ADDR udp 1-64999
> ```
> 
> You are already redirecting all ports to the router. You may have an issue in /etc/shorewall/params.vpn

I've tried it both with and without V2Ray, and the result is always the same. I'm attaching screenshots of the TCP dumps from both methods.

And why do I have this?

DNAT net vpn:$OMR_ADDR tcp 1-64999
DNAT net vpn:$OMR_ADDR udp 1-64999

I have no idea. I don't know what it means either; I don't know enough about the topic.

In /etc/shorewall/params.vpn it says:

VPS_ADDR=10.255.255.1
OMR_ADDR=10.255.255.2
OMR_ADDR=10.255.255.2
OMR_ADDR=10.255.255.2
OMR_ADDR=10.255.255.2
OMR_ADDR=10.255.255.2
VPS_IFACE=gt-tun0
OMR_ADDR=10.255.255.2
OMR_ADDR=10.255.255.2
OMR_ADDR=10.255.255.2
OMR_ADDR=10.255.255.2


![root@OpenMPTCProuter_ ~ 19 03 2025 13_22_02](https://github.com/user-attachments/assets/4526408e-c274-4865-866d-e291e19514b8)
![root@OpenMPTCProuter_ ~ 19 03 2025 13_22_32](https://github.com/user-attachments/assets/9f04ecda-c532-4877-b35d-822a507c8536)

**Reply by Ysurac** [reply]
For the "DNAT ... 1-64999", you have the "redirect all ports from server to router" checkbox enabled in System->OpenMPTCProuter->Advanced settings tab.
What is the result of ```tcpdump -i any -p port 3544``` on the VPS ? (to check if something is really coming on the server)

**Reply by MatzDerTrainer** [reply]
The command tcpdump -i any -p port 3544 returns the message “Command not found.”

**Reply by Ysurac** [reply]
I made an error was tcodump instead of tcpdump if you copy/paste. But tcpdump exist. Else install tcpdump on the VPS.

**Reply by MatzDerTrainer** [reply]
How do I install tcpdump on the VPS?
I assume there's a script for that, but I haven't found anything.

**Reply by Ysurac** [reply]
apt-get install tcpdump

**Reply by MatzDerTrainer** [reply]
THX.

tcpdump on the vps:

root@v1730XXXXXX:~# tcpdump -i any -p port 3544
tcpdump: data link type LINUX_SLL2
tcpdump: verbose output suppressed, use -v[v]... for full protocol decode
listening on any, link-type LINUX_SLL2 (Linux cooked v2), snapshot length 262144                                                                                                                bytes
09:51:31.599649 eth0  In  IP 198.199.98.246.60475 > 2.59.XXX.XXX.3544: Flags [S]                                                                                                               , seq 2578279208, win 14600, options [mss 1460,sackOK,TS val 3488228363 ecr 0,no                                                                                                               p,wscale 8], length 0
09:51:31.599760 gt-udp-tun0 Out IP 198.199.98.246.60475 > 10.255.254.2.3544: Fla                                                                                                               gs [S], seq 2578279208, win 14600, options [mss 1460,sackOK,TS val 3488228363 ec                                                                                                               r 0,nop,wscale 8], length 0
09:51:31.620812 gt-udp-tun0 In  IP 10.255.254.2.3544 > 198.199.98.246.60475: Fla                                                                                                               gs [R.], seq 0, ack 2578279209, win 0, length 0
09:51:31.620855 eth0  Out IP 2.59.XXX.XXX.3544 > 198.199.98.246.60475: Flags [R.                                                                                                               ], seq 0, ack 2578279209, win 0, length 0
09:51:31.769355 eth0  In  IP 198.199.98.246.60477 > 2.59.XXX.XXX.3544: Flags [S]                                                                                                               , seq 1077431092, win 14600, options [mss 1460,sackOK,TS val 3488228406 ecr 0,no                                                                                                               p,wscale 8], length 0
09:51:31.769445 gt-udp-tun0 Out IP 198.199.98.246.60477 > 10.255.254.2.3544: Fla                                                                                                               gs [S], seq 1077431092, win 14600, options [mss 1460,sackOK,TS val 3488228406 ec                                                                                                               r 0,nop,wscale 8], length 0
09:51:31.796339 gt-udp-tun0 In  IP 10.255.254.2.3544 > 198.199.98.246.60477: Fla                                                                                                               gs [R.], seq 0, ack 1077431093, win 0, length 0
09:51:31.796383 eth0  Out IP 2.59.XXX.XXX.3544 > 198.199.98.246.60477: Flags [R.                                                                                                               ], seq 0, ack 1077431093, win 0, length 0
09:51:31.944051 eth0  In  IP 198.199.98.246.60478 > 2.59.XXX.XXX.3544: Flags [S]                                                                                                               , seq 1091044530, win 14600, options [mss 1460,sackOK,TS val 3488228450 ecr 0,no                                                                                                               p,wscale 8], length 0
09:51:31.944128 gt-udp-tun0 Out IP 198.199.98.246.60478 > 10.255.254.2.3544: Fla                                                                                                               gs [S], seq 1091044530, win 14600, options [mss 1460,sackOK,TS val 3488228450 ec                                                                                                               r 0,nop,wscale 8], length 0
09:51:31.964350 gt-udp-tun0 In  IP 10.255.254.2.3544 > 198.199.98.246.60478: Fla                                                                                                               gs [R.], seq 0, ack 1091044531, win 0, length 0
09:51:31.964378 eth0  Out IP 2.59.XXX.XXX.3544 > 198.199.98.246.60478: Flags [R.                                                                                                               ], seq 0, ack 1091044531, win 0, length 0

12 packets captured
13 packets received by filter
0 packets dropped by kernel


And thank you for your time and effort

**Reply by Ysurac** [reply]
Here you correctly have answer from the VPN on the router side. But it's Glorytun UDP, firewall configuration was on Glorytun TCP, this seems impossible.
If you changed configuration between tests then it seems to be working here. With the same tcpdump command on the router you should have data.

**Reply by MatzDerTrainer** [reply]
Yes, that's right. I switched to Glorytun UDP because port 3544 should be opened via UDP, and I was hoping that would open it, but unfortunately it isn't. I'll switch back to Glortun TCP and run another tcpdump on the VPS.

When I run tcpdump on the router I get the following message:

root@OpenMPTCProuter:~# tcpdump -i any -p port 3544
Error relocating /usr/bin/tcpdump: pcap_open: symbol not found
Error relocating /usr/bin/tcpdump: pcap_findalldevs_ex: symbol not found



Now all that's left to do is run the following command on the VPS using the tcpdump command:
root@v1730XXXXXX:~# tcpdump -i any -p port 3544
tcpdump: data link type LINUX_SLL2
tcpdump: verbose output suppressed, use -v[v]... for full protocol decode
listening on any, link-type LINUX_SLL2 (Linux cooked v2), snapshot length 262144 bytes

How the hell does the full log appear?

Sorry for my ignorance.

**Reply by Ysurac** [reply]
tcpdump was working before in your tests, you changed something ?

**Reply by MatzDerTrainer** [reply]
Yes, I switched to Glorytun TCP. After the tcpdump was so meaningless, I switched back to Glorytun UDP, but it looked the same.
Is there a folder where the full log is saved?

**Reply by Ysurac** [reply]
Nothing that you can see in log.
tcpdump should be running the same on both VPS and router side and give output on both side.
On VPS side, every lines with eth0 mean something enter or exit from VPS and with gt-* mean same from VPN. So in previous log you have VPN traffic on both side.
On router side you should see same traffic that enter or exit from tun0.

If there is in fact really traffic on both side, you may need to set SNAT.

**Reply by MatzDerTrainer** [reply]
I think I'm slowly starting to understand how tcpdump works. It's basically a live view of the port being monitored. So, something should only show up when the port is accessed, right?

What exactly is SNAT's function, and what do I need to configure? Port disclosure shouldn't be done via V2ray, but rather via VPN, right?
